StratÈgie;Budget;Audience;DurÈe_Campagne_Jours;Objectif;Type_Produit;Niveau_Concurrence;Taille_Èquipe_Marketing;PrÈsence_Digitale_Score;Engagement_Likes;Engagement_Partages;Engagement_Commentaires;Canal_Principal;Cycle_Vente;Taux_Conversion;CPA;Taux_RÈtention;ROI;Taux_Rebond;CTR;Taux_Ouverture;Taux_Partage;SaisonnalitÈ;Tendance;Age_Cible;Genre_Cible;Plateforme_PrÈfÈrÈe;Description
SEO;Moyen;B2B;365;Awareness;Digital;8;5;75;1200;300;150;Google;Long;5%;50‚Ç¨;70%;200%;40%;2%;N/A;10%;Toute l'ann√©e;Croissance;25-45;Mixte;Desktop;Optimisation du r√©f√©rencement naturel pour am√©liorer la visibilit√© sur les moteurs de recherche et attirer du trafic qualifi√© √† long terme.
SEA;√âlev√©;B2C;30;Conversion;Physique;6;3;85;500;100;50;Google;Rapide;10%;20‚Ç¨;50%;150%;30%;5%;N/A;5%;Toute l'ann√©e;Stable;18-35;Mixte;Mobile;Publicit√© payante sur les moteurs de recherche pour attirer des prospects imm√©diatement et g√©n√©rer des conversions rapides.
Content Marketing;Moyen;Mixte;180;Engagement;Digital;7;8;65;2500;800;400;Blog/YouTube;Moyen;7%;30‚Ç¨;60%;180%;35%;3%;N/A;15%;Toute l'ann√©e;Croissance;18-45;Mixte;Mobile;Cr√©ation et partage de contenu pertinent (articles, vid√©os, infographies) pour √©duquer, engager et fid√©liser l‚Äôaudience.
Social Media Marketing;Moyen;B2C;90;Awareness;Service;4;6;70;3000;1200;600;Facebook/Instagram;Moyen;4%;40‚Ç¨;55%;120%;25%;4%;N/A;20%;Toute l'ann√©e;Stable;18-30;F√©minin;Mobile;Utilisation des r√©seaux sociaux pour renforcer la notori√©t√© de la marque, engager la communaut√© et interagir avec les clients potentiels.
Email Marketing;Faible;B2B;14;R√©tention client;Digital;3;2;60;N/A;N/A;N/A;Email;Rapide;8%;10‚Ç¨;80%;250%;N/A;N/A;25%;5%;Toute l'ann√©e;Stable;30-50;Mixte;Desktop;Envoi de campagnes d‚Äôemails cibl√©es pour nourrir la relation client, fid√©liser et g√©n√©rer des ventes r√©currentes.
Affiliate Marketing;Faible;Mixte;60;Conversion;Physique;5;4;55;N/A;N/A;N/A;Sites Partenaires;Moyen;6%;15‚Ç¨;65%;130%;N/A;N/A;N/A;10%;Toute l'ann√©e;Stable;25-40;Mixte;Desktop;Collaboration avec des partenaires affili√©s pour promouvoir les produits/services en √©change d‚Äôune commission sur les ventes g√©n√©r√©es.
Influence Marketing;√âlev√©;B2C;30;Awareness;Physique;6;7;80;4000;1500;800;Instagram/TikTok;Rapide;3%;50‚Ç¨;40%;100%;20%;6%;N/A;25%;√ât√©;Croissance;18-25;F√©minin;Mobile;Partenariats avec des influenceurs pour toucher un public cibl√© et renforcer la cr√©dibilit√© de la marque aupr√®s des consommateurs.
Publicit√© Display;√âlev√©;Mixte;45;Awareness;Digital;9;6;90;N/A;N/A;N/A;Sites Web;Rapide;2%;60‚Ç¨;30%;80%;50%;1%;N/A;5%;Toute l'ann√©e;Stable;18-45;Mixte;Desktop;Diffusion d‚Äôannonces visuelles sur des sites web et plateformes pour accro√Ætre la visibilit√© et attirer l'attention des prospects.
Growth Hacking;Moyen;B2B;60;Acquisition;Digital;5;4;70;N/A;N/A;N/A;Multi-canal;Rapide;9%;25‚Ç¨;75%;220%;N/A;N/A;N/A;10%;Toute l'ann√©e;Croissance;25-40;Mixte;Desktop;Utilisation de techniques innovantes et √† faible co√ªt pour acc√©l√©rer la croissance d‚Äôune entreprise via l‚Äôexp√©rimentation et l‚Äôautomatisation.
Marketing Viral;Moyen;Mixte;90;Engagement;Digital;6;5;75;5000;2000;1000;R√©seaux Sociaux;Court;12%;15‚Ç¨;85%;300%;20%;10%;N/A;30%;√ât√©;Croissance;18-35;Mixte;Mobile;Strat√©gies con√ßues pour encourager les utilisateurs √† partager du contenu ou des offres, augmentant ainsi la port√©e organique.
Marketing Automation;Faible;B2B;365;R√©tention client;Digital;4;3;80;N/A;N/A;N/A;Email;Long;10%;5‚Ç¨;90%;400%;N/A;N/A;30%;N/A;Toute l'ann√©e;Croissance;30-50;Mixte;Desktop;Utilisation de logiciels pour automatiser les t√¢ches marketing r√©p√©titives, comme les campagnes d'emails et les workflows de lead nurturing.
Marketing de Contenu Utilisateur (UGC);Moyen;B2C;180;Engagement;Service;5;6;70;6000;2500;1200;Instagram/TikTok;Moyen;8%;20‚Ç¨;75%;250%;15%;8%;N/A;35%;Toute l'ann√©e;Croissance;18-30;Mixte;Mobile;Encouragement des clients √† cr√©er et partager du contenu li√© √† la marque, augmentant ainsi l'engagement et la cr√©dibilit√©.
Marketing Mobile;√âlev√©;B2C;60;Conversion;Digital;7;5;85;N/A;N/A;N/A;Applications Mobiles;Rapide;15%;10‚Ç¨;60%;200%;N/A;N/A;N/A;20%;Toute l'ann√©e;Croissance;18-35;Mixte;Mobile;Campagnes sp√©cifiquement con√ßues pour les utilisateurs mobiles, incluant des notifications push et des publicit√©s in-app.
Marketing Exp√©rientiel;√âlev√©;Mixte;30;Engagement;Physique;6;8;60;N/A;N/A;N/A;√âv√©nements;Court;5%;100‚Ç¨;50%;120%;N/A;N/A;N/A;10%;√ât√©;Stable;25-45;Mixte;Physique;Cr√©ation d'exp√©riences immersives pour les clients, comme des √©v√©nements ou des pop-up stores, pour renforcer l'engagement et la notori√©t√© de la marque.
Marketing de Cohorte;Moyen;B2B;180;R√©tention client;Digital;5;4;75;N/A;N/A;N/A;Email;Moyen;12%;8‚Ç¨;85%;350%;N/A;N/A;20%;N/A;Toute l'ann√©e;Croissance;30-50;Mixte;Desktop;Segmentation des clients en groupes bas√©s sur des comportements ou des caract√©ristiques similaires pour personnaliser les campagnes marketing.
Marketing de Personnalisation;Moyen;Mixte;90;Conversion;Digital;6;5;80;N/A;N/A;N/A;Multi-canal;Moyen;10%;12‚Ç¨;80%;300%;N/A;N/A;N/A;15%;Toute l'ann√©e;Croissance;25-45;Mixte;Mobile;Utilisation de donn√©es pour personnaliser les messages et offres pour chaque client, augmentant ainsi les taux de conversion.
Marketing de R√©seau (Network Marketing);Faible;Mixte;365;Conversion;Physique;4;3;50;N/A;N/A;N/A;R√©seaux de Distributeurs;Long;7%;5‚Ç¨;70%;150%;N/A;N/A;N/A;5%;Toute l'ann√©e;Stable;25-60;Mixte;Physique;Strat√©gies bas√©es sur la vente directe via un r√©seau de distributeurs, souvent utilis√©es pour les produits de consommation.
