product_name,description,ad
Blouse Fluide à Manches Longues,"Une blouse légère et fluide, parfaite pour un look élégant et confortable.","Adoptez l’élégance sans effort avec notre Blouse Fluide – chic, douce et toujours tendance!"
Pantalon Carotte Taille Haute,Un pantalon taille haute avec une coupe carotte flatteuse pour toutes les silhouettes.,Faites sensation avec notre Pantalon Carotte – élégance et confort réunis!
Robe Portefeuille Fleurie,"Une robe portefeuille avec un imprimé floral délicat, idéale pour le printemps et l’été.","Laissez-vous séduire par notre Robe Portefeuille Fleurie – fraîcheur, féminité et légèreté!"
Pull Col Roulé Doux,"Un pull à col roulé en maille douce, parfait pour les journées fraîches.","Restez au chaud avec style – essayez notre Pull Col Roulé Doux, confort garanti!"
Jupe Longue Plissée,Une jupe longue plissée pour un look romantique et sophistiqué.,Élégance fluide assurée avec notre Jupe Longue Plissée – un incontournable du dressing.
Top en Dentelle,"Un top raffiné orné de dentelle délicate, idéal pour les soirées.","Faites tourner les têtes avec notre Top en Dentelle – subtil, chic et glamour!"
Veste Oversize en Jean,Une veste en jean oversize pour un look urbain et décontracté.,Affirmez votre style avec notre Veste Oversize – le jean n’a jamais été aussi cool!
Combinaison Pantalon Élégante,"Une combinaison chic avec ceinture à la taille, parfaite pour un look habillé sans effort.",Tout-en-un et stylée – notre Combinaison Élégante vous habille en un clin d’œil!
Robe Pull Tricotée,"Une robe pull douce et chaude, idéale pour l’automne-hiver.",Douceur garantie avec notre Robe Pull – chaleur et style au rendez-vous!
Top Épaules Dénudées,"Un top léger avec épaules dénudées, parfait pour un style estival et romantique.",Montrez vos épaules avec élégance – notre Top Épaules Dénudées est fait pour vous!
Short Taille Haute Ceinturé,Un short chic avec une taille haute et une ceinture pour une touche féminine.,Craquez pour le confort stylé avec notre Short Taille Haute Ceinturé – tendance et pratique!
Gilet Long en Maille,"Un gilet long et doux, parfait pour les superpositions d’automne.",Enveloppez-vous de douceur avec notre Gilet Long – la pièce cocooning par excellence!
Robe Trapèze Unie,"Une robe simple en coupe trapèze, facile à accessoiriser pour toutes les occasions.",Simplicité raffinée – notre Robe Trapèze s’adapte à toutes vos envies.
Chemisier Satiné,Un chemisier fluide en satin pour une touche de brillance dans votre tenue.,Brillez sans effort avec notre Chemisier Satiné – glamour au naturel!
Pantalon Palazzo Imprimé,"Un pantalon large aux imprimés vibrants, parfait pour un look audacieux.",Osez les imprimés! Le Pantalon Palazzo est là pour révéler votre personnalité.
Robe Midi à Volants,Une robe longueur midi avec des volants pour un effet fluide et féminin.,Dansez avec style! La Robe Midi à Volants est faite pour bouger avec grâce.
Blazer Cintré Classique,Un blazer ajusté pour un look professionnel et structuré.,Le Blazer Cintré – votre allié élégance pour un look business sans faute!
Tunique Bohème à Broderies,Une tunique fluide avec des détails brodés inspirés du style bohème.,Laissez parler votre esprit libre avec notre Tunique Bohème – chic et authentique!
Débardeur Basique Côtelé,"Un débardeur ajusté avec texture côtelée, un essentiel du quotidien.","Simple et efficace – notre Débardeur Côtelé se porte partout, tout le temps!"
Robe T-Shirt Décontractée,Une robe en forme de t-shirt pour un look décontracté et moderne.,Confort et style réunis – la Robe T-Shirt est votre nouvelle alliée casual!
Pantalon Paperbag à Pinces,"Un pantalon avec taille froncée et pinces élégantes, très flatteur.",Structure et souplesse – le Pantalon Paperbag affine votre silhouette avec goût.
Blouse à Col Lavallière,"Une blouse élégante avec un nœud lavallière au col, pour une allure chic rétro.",Rétro et tendance – notre Blouse à Col Lavallière sublime vos tenues pro ou festives.
Robe à Manches Ballon,"Une robe féminine avec des manches ballon volumineuses, originale et élégante.","Volume et style – la Robe à Manches Ballon, c’est l’élégance au naturel!"
Tee-Shirt Oversize Imprimé,"Un t-shirt ample avec un imprimé graphique, parfait pour un look urbain.",Soyez cool et stylée avec notre Tee-Shirt Oversize – streetwear garanti!
Jupe Portefeuille en Lin,"Une jupe portefeuille légère en lin naturel, parfaite pour l’été.",Légèreté et naturel – la Jupe Portefeuille en Lin est votre alliée des beaux jours!
Linen Wide-Leg Pants,"Breathable and loose-fitting pants made from pure linen, ideal for warm weather and casual outings.","Stay cool in style! Our Linen Wide-Leg Pants are the ultimate comfort combo for sunny days. Lightweight, breezy, and effortlessly chic!"
Cropped Denim Jacket,"A cropped version of the classic denim jacket, perfect for layering and adding an edge to any outfit.","Add instant cool to any look with our Cropped Denim Jacket! Classic denim, modern cut – a must-have piece for your wardrobe."
Striped Maxi Dress,"A long, flowy dress featuring vertical stripes that elongate the silhouette, ideal for summer vibes.","Meet your summer favorite: the Striped Maxi Dress! Flow, flare, and flattering stripes – grab yours before it’s gone!"
Knitted Crop Top,"A soft and trendy crop top made of breathable knit, perfect for pairing with high-waisted bottoms.",Cozy meets cute in the Knitted Crop Top! Pair it with your faves and own that chic summer look!
High-Waist Culottes,"Fashion-forward culottes with a high waistline, offering elegance and comfort.","Chic and comfy? Yes, please! Step out in our High-Waist Culottes – tailored for trendsetters like you."
Lace Kimono Cover-Up,"A lightweight kimono-style cover-up with delicate lace detailing, great for layering or beachwear.",Delicate elegance! The Lace Kimono Cover-Up adds charm to any outfit or beach look. Shop this dreamy layer today!
V-Neck Ruffle Blouse,A lightweight blouse featuring a flattering V-neckline and playful ruffle accents.,"Turn heads with the V-Neck Ruffle Blouse! Feminine, flirty, and perfect for any sunny day."
Pleated Mini Skirt,"A flirty mini skirt with structured pleats, perfect for a playful and stylish outfit.","Bring on the charm with the Pleated Mini Skirt! Perfect for day or night – fun, fresh, and fab!"
Chiffon Wrap Dress,"A flowy wrap dress in chiffon fabric, ideal for evening events or a breezy daytime look.","Effortless grace starts with the Chiffon Wrap Dress – elegant, floaty, and irresistibly romantic!"
Oversized Button-Up Shirt,A relaxed-fit button-up shirt that can be styled as a dress or layered over outfits.,"Redefine effortless cool with the Oversized Button-Up Shirt. One shirt, endless styles!"
Embroidered Tunic,"A stylish tunic adorned with colorful embroidery, combining comfort and flair.",Stand out with bold details! The Embroidered Tunic brings tradition and trend together beautifully.
Soft Knit Cardigan,"A lightweight, cozy cardigan perfect for layering in any season.",Snuggle into softness! The Soft Knit Cardigan is your layering essential all year long.
Slit Midi Skirt,A midi-length skirt with a subtle side slit for added movement and style.,Move freely and fashionably in our Slit Midi Skirt – where sophistication meets sass!
Boho Printed Romper,"A one-piece romper featuring a boho-inspired print, perfect for festivals and fun.","Boho vibes, effortless style. Rock our Printed Romper and dance through the day!"
Sheer Sleeve Blouse,"A blouse with transparent sleeves, adding a hint of allure to a classic silhouette.",Classic meets contemporary in the Sheer Sleeve Blouse – a touch of elegance in every detail.
Ribbed Tank Top,"A fitted tank top with a ribbed texture, ideal for layering or wearing solo.","Simple, sleek, and essential – our Ribbed Tank Top goes with everything!"
Asymmetrical Skirt,A skirt with an uneven hemline that adds dynamic style and flair.,"Dare to stand out in our Asymmetrical Skirt – edgy, trendy, and ready to twirl!"
Printed Palazzo Pants,"Wide-leg palazzo pants with bold prints, combining statement fashion and comfort.",Bold moves only! Printed Palazzo Pants that scream confidence and feel like a dream.
Ruffle Shoulder Dress,"A dress with ruffle accents on the shoulders, adding volume and fun to the look.",Bring the drama! The Ruffle Shoulder Dress adds playful volume for maximum impact.
Tie-Front Top,"A chic top featuring a stylish front-tie detail, perfect for summer looks.","The Tie-Front Top is your new sunny day essential – sweet, breezy, and always on trend!"
Smocked Waist Skirt,A comfy skirt with a stretchy smocked waist and flowy bottom.,Smocked and stunning! This skirt flatters your shape and keeps it comfy.
Mesh Overlay Dress,"A layered dress with a sheer mesh overlay, adding texture and dimension.",Textured and trendy – the Mesh Overlay Dress takes your style to new heights!
Mock Neck Top,"A sleeveless top with a mock neckline, great for layering or standing alone.","Stay sleek with our Mock Neck Top – minimal yet bold, your new fave piece."
Paperbag Waist Shorts,"Shorts featuring a paperbag-style waist with a tie, combining comfort and polish.",Cute meets classy in our Paperbag Waist Shorts – cinch your style with ease!
Bell Sleeve Tunic,"A tunic with flared bell sleeves, offering flowy comfort and visual drama.","Make waves in our Bell Sleeve Tunic – flowy, fun, and fabulously you!"
سروال تريكوات,سروال مريّح، مصنوع من قماش التريكوات، يلبس في الدار ولا للخروج الخفيف.,كومفور ومود، سروال التريكوات يعطيك الراحة والستايل في نفس الوقت! جربو تاو قبل ما يوفى الستوك!
بلوزة نص كم,بلوزة خفيفة بنص كم، تصلح للصيف ولا للبس تحت جاكيت.,بلوزتك للصيف موجودة! بلوزة نص كم بخامة خفيفة، متوفرة في ألوان جديدة. شدّ بلاصتك!
فستان طويل مزهر,فستان طويل بنقشة ورود، خفيف ويناسب السهرات الصيفية.,عيش الرومانسية مع فستان الزهور! فلو، أنيق ومثالي لأي خرجة صيفية. كليكه تاو!
قميجة دنيم,قميجة من قماش الدينيم، تنجم تلبسها مفتوحة ولا مسكرة، ستايل ديما حاضر.,زيد الستايل بقميجة الدينيم! كلاسيك ومواكب للموضة، لازم تكون في دولابك.
تي شورت برسمة,تي شورت خفيفة فيها رسمة تعبر على شخصيتك.,أظهر روحك بتي شورت برسمة فريدة! ديزاين ياسر كول، متوفر دجا!
جيليه خفيف,جيليه صيفي خفيف، يعطي لمسة مزيانة فوق أي لوك.,زيد النكهة للوك متاعك بجيليه خفيف وستايلي. مزيج بين الكلاسيك والموضة!
فستة مربوحة,فستة طويلة مربوحة، تنجم تلبسها على سروال ولا جين.,حبّيت الراحة والأنوثة؟ الفستة المربوحة موجودة بتصاميم حصرية!
سروال كارجو,سروال عملي فيه جيوب برشا، يصلح للخرجات والستايل اليومي.,كون جاهز لأي نهار بسروال الكارجو! عملي، مودرن، وديما معاك.
شميز بلون ناعم,شميز خفيفة بلون باستيل، مريحة وتخدم مع كل حاجة.,باش تكون ديما سبور شيك، شميز باستيل هي الإختيار! متفلتهاش!
روب ساتان,روب خفيفة من الساتان، للبنات اللي تحب الأناقة والراحة.,لمسة أنثوية في كل تفصيلة، روب الساتان تزيدك أناقة من أول لبسة!
كنزة خفيفة,كنزة صيفية بخامة باردة، تنجم تتلبس نهار كامل.,صيفك يبدأ بكنزة خفيفة تعطيك ستايل وراحة مع بعضهم!
روب قصير مزركش,روب قصيرة فيها نقشة مزركشة تعبر على الفرحة.,خرجة، سهرة ولا قعدة؟ روب مزركشة ديما تكون اختيارك الأول!
جاكيت خفيف,جاكيت بلا أكمام، خفيف ومثالي للصيف مع تي شورت.,زيد الجرأة للوك متاعك بجاكيت خفيف وستايل عصري!
كيمونو خفيف,كيمونو صيفي فيه طبعة بوهيمية، خفيف وشيك.,عيش الأناقة البوهيمية بكيمونو صيفي، ديزاينك المختلف!
قميص قطن,قميص 100% قطن، مريح وينفس على البدن.,الراحة تبدا من القطن! قميصك الصيفي لازم يكون من عندنا.
شورت عالي الخصر,شورت أنيق بخصر عالي، يبرز القوام.,لوك أنثوي ومرتب؟ الشورت العالي هو الحل! متوفر دجا.
سروال خفيف واسع,سروال خفيف واسع من تحت، يلبس مع صبّاط ولا سنيكرز.,عيش راحة الصيف بسروال خفيف واسع، ديما تلقى ستايلك!
فستان كم طويل,فستان ساتر بأكمام طويلة وخامة خفيفة.,خلي أناقتك تتكلم بفستان طويل وراقي! متوفر بألوان متنوعة.
شميز دنتال,شميز مزينة بالدنتال، للخرجات الخاصة.,ستايلي وناعم؟ شميز بالدنتال هي لمستك الخاصة!
روب كروشيه,روب معمول بالكروشيه، فيها لمسة تقليدية معاصرة.,جمعنا بين التراث والموضة في روب كروشيه حصرية!
بلوزة بلا أكمام,بلوزة صيفية بلا أكمام، تلبس مع شورت ولا تنورة.,بلوزة بسيطة ومودرن بلا أكمام، لازمك وحدة في صيفك!
جاكيت جين,جاكيت دينيم تنجم تلبسها صيف ولا شتاء، ستايل ديما.,جاكيت الجينز الكلاسيكية رجعت أقوى! لازم تكون في لوكك.
فستان سبور,فستان مريح وسهل للبس، مثالي لليوم العادي.,ستايل سبور وراحة مضمونة، فستانك اليومي موجود!
كنزة بقبعة,كنزة بقبعة، شبابية ومثالية لأوقات الراحة.,أيام الكاجوال تناديك! كنزة بقبعة ديما موجودة في اللوك العصري.
توب قصير,توب قصير صيفي، أنيق ويناسب القعدة ولا البحر.,توب قصير خفيف لصيفك الساخن! دزّة ستايلية جديدة.
Sac à Dos Urbain,Sac à dos pratique et moderne pour vos déplacements quotidiens.,Optez pour le confort et le style avec notre Sac à Dos Urbain – l'accessoire indispensable!
Sac à Dos Urbain,Sac à dos pratique et moderne pour vos déplacements quotidiens.,Optez pour le confort et le style avec notre Sac à Dos Urbain – l'accessoire indispensable!
جاكيت خفيف صيفي,جاكيت خفيف و أنيق، ينجم يتلبس فوق التيشورتات في الصيف.,متفلتش الجو؟ جاكيتنا الصيفية تعطيك الستايل و تحميك من النسيم!
جاكيت خفيف صيفي,جاكيت خفيف و أنيق، ينجم يتلبس فوق التيشورتات في الصيف.,متفلتش الجو؟ جاكيتنا الصيفية تعطيك الستايل و تحميك من النسيم!
جاكيت خفيف صيفي,جاكيت خفيف و أنيق، ينجم يتلبس فوق التيشورتات في الصيف.,متفلتش الجو؟ جاكيتنا الصيفية تعطيك الستايل و تحميك من النسيم!
جاكيت خفيف صيفي,جاكيت خفيف و أنيق، ينجم يتلبس فوق التيشورتات في الصيف.,متفلتش الجو؟ جاكيتنا الصيفية تعطيك الستايل و تحميك من النسيم!
جاكيت خفيف صيفي,جاكيت خفيف و أنيق، ينجم يتلبس فوق التيشورتات في الصيف.,متفلتش الجو؟ جاكيتنا الصيفية تعطيك الستايل و تحميك من النسيم!
Robe d'Été Fleurie,"Une robe légère avec des motifs floraux, parfaite pour les journées ensoleillées.",Flânez en toute élégance avec notre Robe d'Été Fleurie – fraîcheur et féminité assurées!
جاكيت خفيف صيفي,جاكيت خفيف و أنيق، ينجم يتلبس فوق التيشورتات في الصيف.,متفلتش الجو؟ جاكيتنا الصيفية تعطيك الستايل و تحميك من النسيم!
Robe d'Été Fleurie,"Une robe légère avec des motifs floraux, parfaite pour les journées ensoleillées.",Flânez en toute élégance avec notre Robe d'Été Fleurie – fraîcheur et féminité assurées!
Summer Straw Hat,Lightweight straw hat perfect for sun protection and style.,Beat the heat in style with our Summer Straw Hat – your sunny day essential!
Sac à Dos Urbain,Sac à dos pratique et moderne pour vos déplacements quotidiens.,Optez pour le confort et le style avec notre Sac à Dos Urbain – l'accessoire indispensable!
Sac à Dos Urbain,Sac à dos pratique et moderne pour vos déplacements quotidiens.,Optez pour le confort et le style avec notre Sac à Dos Urbain – l'accessoire indispensable!
Summer Straw Hat,Lightweight straw hat perfect for sun protection and style.,Beat the heat in style with our Summer Straw Hat – your sunny day essential!
Leather Crossbody Bag,Compact and stylish leather bag for everyday use.,"Carry elegance with our Leather Crossbody Bag – small in size, big on style!"
Sac à Dos Urbain,Sac à dos pratique et moderne pour vos déplacements quotidiens.,Optez pour le confort et le style avec notre Sac à Dos Urbain – l'accessoire indispensable!
Sac à Dos Urbain,Sac à dos pratique et moderne pour vos déplacements quotidiens.,Optez pour le confort et le style avec notre Sac à Dos Urbain – l'accessoire indispensable!
جاكيت خفيف صيفي,جاكيت خفيف و أنيق، ينجم يتلبس فوق التيشورتات في الصيف.,متفلتش الجو؟ جاكيتنا الصيفية تعطيك الستايل و تحميك من النسيم!
Sac à Dos Urbain,Sac à dos pratique et moderne pour vos déplacements quotidiens.,Optez pour le confort et le style avec notre Sac à Dos Urbain – l'accessoire indispensable!
Summer Straw Hat,Lightweight straw hat perfect for sun protection and style.,Beat the heat in style with our Summer Straw Hat – your sunny day essential!
جاكيت خفيف صيفي,جاكيت خفيف و أنيق، ينجم يتلبس فوق التيشورتات في الصيف.,متفلتش الجو؟ جاكيتنا الصيفية تعطيك الستايل و تحميك من النسيم!
Leather Crossbody Bag,Compact and stylish leather bag for everyday use.,"Carry elegance with our Leather Crossbody Bag – small in size, big on style!"
Sac à Dos Urbain,Sac à dos pratique et moderne pour vos déplacements quotidiens.,Optez pour le confort et le style avec notre Sac à Dos Urbain – l'accessoire indispensable!
Sac à Dos Urbain,Sac à dos pratique et moderne pour vos déplacements quotidiens.,Optez pour le confort et le style avec notre Sac à Dos Urbain – l'accessoire indispensable!
جاكيت خفيف صيفي,جاكيت خفيف و أنيق، ينجم يتلبس فوق التيشورتات في الصيف.,متفلتش الجو؟ جاكيتنا الصيفية تعطيك الستايل و تحميك من النسيم!
Leather Crossbody Bag,Compact and stylish leather bag for everyday use.,"Carry elegance with our Leather Crossbody Bag – small in size, big on style!"
Robe d'Été Fleurie,"Une robe légère avec des motifs floraux, parfaite pour les journées ensoleillées.",Flânez en toute élégance avec notre Robe d'Été Fleurie – fraîcheur et féminité assurées!
Sac à Dos Urbain,Sac à dos pratique et moderne pour vos déplacements quotidiens.,Optez pour le confort et le style avec notre Sac à Dos Urbain – l'accessoire indispensable!
Leather Crossbody Bag,Compact and stylish leather bag for everyday use.,"Carry elegance with our Leather Crossbody Bag – small in size, big on style!"
شبشب بحر تونسي,شبشب مريح للصيف و البحر، خفيف و ما ينزلقش.,صيفك ما يكملش بلا شبشب البحر التونسي – راحة و جودة عالية!
T-shirt Oversize,Un t-shirt large pour un look décontracté et tendance.,Adoptez le confort ultime avec notre T-shirt Oversize – style urbain garanti!
حزام جلدي كلاسيكي,حزام مصنوع من الجلد الطبيعي، مثالي للبس الكلاسيكي والرسمي.,زيد لمسة كلاسيك على ستيلك مع الحزام الجلدي – أناقة في كل تفصيل!
Travel Duffel Bag,"Spacious and durable duffel bag, perfect for weekend trips.","Pack light, travel smart – our Travel Duffel Bag is your perfect getaway companion!"
نظارات شمسية مربعة,نظارات بصيحة مربعة تعطيك حماية كاملة من الشمس وستيل مودرن.,خلي عينيك مرتاحات وزيد ستيلك مع نظاراتنا الشمسية!
Montre Minimaliste,Montre au design épuré avec bracelet en cuir véritable.,Soyez toujours à l’heure avec élégance grâce à notre Montre Minimaliste!
Striped Cotton Socks,Colorful striped socks made from breathable cotton for daily wear.,Add flair to your feet! Our Striped Cotton Socks keep you comfy and cool all day.
بلوزة قطنية مطرزة,بلوزة فيها تطريز يدوي، تنجم تلبسها في المناسبات أو الخرجات اليومية.,زيدي لمسة فنية على لبستك مع البلوزة المطرزة – أناقة تونسية راقية!
Sneakers Respirantes,Des baskets légères avec tissu respirant pour un confort optimal.,Bougez librement avec nos Sneakers Respirantes – style sportif et confort absolu!
Denim Jacket,Classic denim jacket with a modern cut – perfect for layering.,Get that timeless cool vibe – grab our Denim Jacket now and rock your look!
كاب شتوي مبطن,كاب دافي ومبطن يحميك من البرد في الأيام الباردة.,ما تخليش البرد يوقفك – الكاب الشتوي متاعنا يدفيك ويزيدك ستيل!
حذاء رياضي خفيف #1b21,حذاء مريقل للركض والمشي، خفيف وما يوجعش الرجلين.,خلي كل خطوة مريحة – حذاء رياضي عملي وأنيق!
Wool Beanie #ce2d,Cozy wool beanie to keep your head warm in winter.,Top off your outfit with our Wool Beanie – warm and stylish for cold days!
معطف شتوي طويل #c6e4,معطف دافي وطويل، مثالي للأيام الباردة والممطرة.,عيش الدفء والأناقة مع المعطف الشتوي الطويل – ما تخليش البرد يوقفك!
Chemise Rayée #6d25,Chemise élégante avec rayures verticales pour affiner la silhouette.,Craquez pour notre Chemise Rayée – l’élégance à la française!
Chapeau Fedora #4c96,Un chapeau classique pour un look raffiné et original.,Faites tourner les têtes avec notre Chapeau Fedora – chic et classe!
Pantalon en Lin #29f6,Pantalon léger et fluide pour les journées ensoleillées.,Vivez l’été en douceur avec notre Pantalon en Lin!
Canvas Sneakers #a59c,Durable canvas sneakers ideal for casual wear.,Step into comfort with our Canvas Sneakers – your daily go-to pair!
قميجة مطبعة #7285,قميجة فيها تصاميم تقليدية تونسية بلمسة مودرن.,لبسة تعبر على أصلك – قميجة مطبعة ستيل تونسي!
قميص جينز تونسي #0637,قميص من الجينز الخفيف للرجال والنساء، عملي وعصري.,زيد الستايل مع قميص الجينز – تونسي وأصلي!
Wool Beanie #97d6,Cozy wool beanie to keep your head warm in winter.,Top off your outfit with our Wool Beanie – warm and stylish for cold days!
Veste en Jean Déchirée #6980,"Une veste en jean au look usé, parfaite pour un style urbain.",Adoptez une touche rebelle avec notre Veste Déchirée – 100% tendance!
Chapeau Fedora #116e,Un chapeau classique pour un look raffiné et original.,Faites tourner les têtes avec notre Chapeau Fedora – chic et classe!
معطف شتوي طويل #2410,معطف دافي وطويل، مثالي للأيام الباردة والممطرة.,عيش الدفء والأناقة مع المعطف الشتوي الطويل – ما تخليش البرد يوقفك!
Slim Fit Jeans #f88f,Stylish and stretchy slim-fit jeans for everyday wear.,"Rock your everyday look with our Slim Fit Jeans – sleek, comfy, iconic!"
Veste en Jean Déchirée #8a28,"Une veste en jean au look usé, parfaite pour un style urbain.",Adoptez une touche rebelle avec notre Veste Déchirée – 100% tendance!
Veste en Jean Déchirée #bd83,"Une veste en jean au look usé, parfaite pour un style urbain.",Adoptez une touche rebelle avec notre Veste Déchirée – 100% tendance!
قميجة مطبعة #6868,قميجة فيها تصاميم تقليدية تونسية بلمسة مودرن.,لبسة تعبر على أصلك – قميجة مطبعة ستيل تونسي!
